"Eesnimi";"Perenimi";"Kasutajanimi";"Parool";"Kirjeldus"
"Nadežda";"VillKruus";"nadežda.villkruus";"7GpU4";"Vastutab süsteemi laiade haldusülesannete eest, sealhulgas kasutajate haldus, turvaseadistused ja süsteemi konfigureerimine."
"KarlKristjan";"Juhkam";"karlkristjan.juhkam";"BnhXSXns";"Vastutab ettevõtte finantsjuhtimise eest, tegeleb eelarvete, aruandluse ja finantsanalüüsiga."
"Sten";"Lillemets";"sten.lillemets";"ilmGYIa2";"Tavaline süsteemi kasutaja, kes kasutab süsteemi vastavalt oma rollile ja vastutustele."
"Õie";"VillKruus";"õie.villkruus";"IdbHSWQ9";"Vastutab süsteemi laiade haldusülesannete eest, sealhulgas kasutajate haldus, turvaseadistused ja süsteemi konfigureerimine."
"Õie";"Korol";"õie.korol";"86PV14Q";"Tavaline süsteemi kasutaja, kes kasutab süsteemi vastavalt oma rollile ja vastutustele."
